{
  "$schema": "../../schema/word-entries.schema.json",
  "version": 1,
  "locale": "en",
  "description": "Per-word overrides for syllabification, stress, or category where heuristics are insufficient.",
  "entries": [
    { "word": "twinkle", "syllables": ["twin", "kle"], "stress": ["primary", "unstressed"] },
    { "word": "little", "syllables": ["lit", "tle"], "stress": ["primary", "unstressed"] },
    { "word": "star", "stress": ["primary"] },
    { "word": "wonder", "syllables": ["won", "der"], "stress": ["primary", "unstressed"] },
    { "word": "wonderful", "syllables": ["won", "der", "ful"], "stress": ["primary", "unstressed", "secondary"] },
    { "word": "diamond", "syllables": ["dia", "mond"], "stress": ["primary", "unstressed"] },
    { "word": "shining", "syllables": ["shi", "ning"], "stress": ["primary", "unstressed"] },
    { "word": "world", "stress": ["primary"] },
    { "word": "hello", "syllables": ["hel", "lo"], "stress": ["primary", "unstressed"] },
    { "word": "music", "syllables": ["mu", "sic"], "stress": ["primary", "unstressed"] },
    { "word": "singing", "syllables": ["sin", "ging"], "stress": ["primary", "unstressed"] },
    { "word": "happy", "syllables": ["hap", "py"], "stress": ["primary", "unstressed"] },
    { "word": "return", "syllables": ["re", "turn"], "stress": ["unstressed", "primary"] },
    { "word": "rebuild", "syllables": ["re", "build"], "stress": ["unstressed", "primary"] },
    { "word": "unhappy", "syllables": ["un", "hap", "py"], "stress": ["unstressed", "primary", "unstressed"] },
    { "word": "connect", "syllables": ["con", "nect"], "stress": ["unstressed", "primary"] },
    { "word": "disconnect", "syllables": ["dis", "con", "nect"], "stress": ["unstressed", "unstressed", "primary"] },
    { "word": "exchange", "syllables": ["ex", "change"], "stress": ["unstressed", "primary"] },
    { "word": "enable", "syllables": ["en", "a", "ble"], "stress": ["unstressed", "primary", "unstressed"] },
    { "word": "computer", "syllables": ["com", "pu", "ter"], "stress": ["primary", "unstressed", "secondary"] },
    { "word": "photograph", "syllables": ["pho", "to", "graph"], "stress": ["primary", "unstressed", "secondary"] },
    { "word": "beautiful", "syllables": ["beau", "ti", "ful"], "stress": ["primary", "unstressed", "secondary"] },
    { "word": "together", "syllables": ["to", "geth", "er"], "stress": ["unstressed", "primary", "unstressed"] },
    { "word": "another", "syllables": ["a", "noth", "er"], "stress": ["unstressed", "primary", "unstressed"] },
    { "word": "everything", "syllables": ["ev", "ery", "thing"], "stress": ["primary", "unstressed", "secondary"] },
    { "word": "before", "syllables": ["be", "fore"], "stress": ["unstressed", "primary"] },
    { "word": "away", "syllables": ["a", "way"], "stress": ["unstressed", "primary"] },
    { "word": "ago", "syllables": ["a", "go"], "stress": ["unstressed", "primary"] },
    { "word": "jingle", "syllables": ["jin", "gle"], "stress": ["primary", "unstressed"] },
    { "word": "bells", "stress": ["primary"] },
    { "word": "above", "syllables": ["a", "bove"], "stress": ["unstressed", "primary"] },
    { "word": "table", "syllables": ["ta", "ble"], "stress": ["primary", "unstressed"] },
    { "word": "melody", "syllables": ["mel", "o", "dy"], "stress": ["primary", "unstressed", "secondary"] },
    { "word": "harmony", "syllables": ["har", "mo", "ny"], "stress": ["primary", "unstressed", "secondary"] }
  ]
}
