{
  "$schema": "../../schema/word-entries.schema.json",
  "version": 1,
  "locale": "fr",
  "description": "French per-word overrides for common phrases and songs.",
  "entries": [
    { "word": "bonjour", "syllables": ["bon", "jour"], "stress": ["primary", "unstressed"] },
    { "word": "bonsoir", "syllables": ["bon", "soir"], "stress": ["primary", "unstressed"] },
    { "word": "monde", "syllables": ["monde"], "stress": ["primary"] },
    { "word": "étoile", "syllables": ["é", "toile"], "stress": ["unstressed", "primary"] },
    { "word": "étoiles", "syllables": ["é", "toiles"], "stress": ["unstressed", "primary"] },
    { "word": "petite", "syllables": ["pe", "tite"], "stress": ["unstressed", "primary"] },
    { "word": "petit", "syllables": ["pe", "tit"], "stress": ["unstressed", "primary"] },
    { "word": "brille", "syllables": ["brille"], "stress": ["primary"] },
    { "word": "chanson", "syllables": ["chan", "son"], "stress": ["primary", "unstressed"] },
    { "word": "chansons", "syllables": ["chan", "sons"], "stress": ["primary", "unstressed"] },
    { "word": "musique", "syllables": ["mu", "sique"], "stress": ["primary", "unstressed"] },
    { "word": "belle", "syllables": ["belle"], "stress": ["primary"] },
    { "word": "beau", "syllables": ["beau"], "stress": ["primary"] },
    { "word": "merci", "syllables": ["mer", "ci"], "stress": ["primary", "unstressed"] },
    { "word": "français", "syllables": ["fran", "çais"], "stress": ["primary", "unstressed"] },
    { "word": "nuit", "syllables": ["nuit"], "stress": ["primary"] },
    { "word": "jour", "syllables": ["jour"], "stress": ["primary"] },
    { "word": "soleil", "syllables": ["so", "leil"], "stress": ["primary", "unstressed"] },
    { "word": "lune", "syllables": ["lune"], "stress": ["primary"] },
    { "word": "heureux", "syllables": ["heu", "reux"], "stress": ["primary", "unstressed"] },
    { "word": "chanter", "syllables": ["chan", "ter"], "stress": ["primary", "unstressed"] },
    { "word": "enfant", "syllables": ["en", "fant"], "stress": ["primary", "unstressed"] },
    { "word": "famille", "syllables": ["fa", "mille"], "stress": ["primary", "unstressed"] },
    { "word": "école", "syllables": ["é", "cole"], "stress": ["unstressed", "primary"] },
    { "word": "temps", "syllables": ["temps"], "stress": ["primary"] },
    { "word": "travail", "syllables": ["tra", "vail"], "stress": ["primary", "unstressed"] },
    { "word": "magnifique", "syllables": ["mag", "ni", "fique"], "stress": ["primary", "unstressed", "unstressed"] },
    { "word": "parler", "syllables": ["par", "ler"], "stress": ["primary", "unstressed"] },
    { "word": "au revoir", "syllables": ["au", "re", "voir"], "stress": ["unstressed", "unstressed", "primary"] },
    { "word": "s'il vous plaît", "syllables": ["s'il", "vous", "plaît"], "stress": ["unstressed", "unstressed", "primary"] },
    { "word": "france", "syllables": ["france"], "stress": ["primary"] },
    { "word": "petites", "syllables": ["pe", "tites"], "stress": ["unstressed", "primary"] },
    { "word": "belles", "syllables": ["belles"], "stress": ["primary"] },
    { "word": "étoilée", "syllables": ["é", "toi", "lée"], "stress": ["unstressed", "primary", "unstressed"] }
  ]
}
